{
  "$schema": "./schema/registry.schema.json",
  "schemaVersion": 2,
  "registryVersion": "2026.10.17",
  "updatedAt": "2026-10-17",
  "runtimes": [
    {
      "id": "llama.cpp",
      "version": "b11669",
      "license": {
        "id": "MIT",
        "name": "MIT License",
        "url": "https://github.com/ggml-org/llama.cpp/blob/master/LICENSE",
        "commercialUse": true,
        "notes": "CUDA runtime packs contain NVIDIA redistributables under the CUDA EULA."
      },
      "assets": [
        {
          "os": "windows",
          "arch": "x86_64",
          "backend": "cpu",
          "variant": "cpu",
          "files": [
            {
              "url": "https://github.com/ggml-org/llama.cpp/releases/download/b11669/llama-b11669-bin-win-cpu-x64.zip",
              "sizeBytes": 19537886,
              "sha256": "37b3efcf962847ca869745fd4ccf7f5e7e8dacfeff9fa3523b4ca8cdc66d632b"
            }
          ],
          "bundled": true
        },
        {
          "os": "windows",
          "arch": "x86_64",
          "backend": "vulkan",
          "variant": "vulkan",
          "files": [
            {
              "url": "https://github.com/ggml-org/llama.cpp/releases/download/b11669/llama-b11669-bin-win-vulkan-x64.zip",
              "sizeBytes": 32182350,
              "sha256": "2c07574e7bde71321cb785282b20cc821e951132149eeceeea32ddebdbf0598e"
            }
          ],
          "bundled": true
        },
        {
          "os": "windows",
          "arch": "x86_64",
          "backend": "cuda",
          "variant": "cuda-13.4",
          "files": [
            {
              "url": "https://github.com/ggml-org/llama.cpp/releases/download/b11669/llama-b11669-bin-win-cuda-13.4-x64.zip",
              "sizeBytes": 154582227,
              "sha256": "3b92d5c064f5032e603e531d3ec8961f3bd6613e5dfad047399a92dec8e95dbc"
            },
            {
              "url": "https://github.com/ggml-org/llama.cpp/releases/download/b11669/cudart-llama-bin-win-cuda-13.4-x64.zip",
              "sizeBytes": 423535356,
              "sha256": "738f8c251ac22b70c3ae6f83a10cf222725df0395246a2cf58f32bdb85fbe668"
            }
          ],
          "bundled": false,
          "minCudaDriver": "13.0"
        },
        {
          "os": "windows",
          "arch": "x86_64",
          "backend": "cuda",
          "variant": "cuda-12.4",
          "files": [
            {
              "url": "https://github.com/ggml-org/llama.cpp/releases/download/b11669/llama-b11669-bin-win-cuda-12.4-x64.zip",
              "sizeBytes": 266582698,
              "sha256": "c2da1f73ed176ae093ac5aceb978a7b167a16113f6d74c6789eeaee2135cb8dc"
            },
            {
              "url": "https://github.com/ggml-org/llama.cpp/releases/download/b11669/cudart-llama-bin-win-cuda-12.4-x64.zip",
              "sizeBytes": 391443627,
              "sha256": "8c79a9b226de4b3cacfd1f83d24f962d0773be79f1e7b75c6af4ded7e32ae1d6"
            }
          ],
          "bundled": false,
          "minCudaDriver": "12.4"
        },
        {
          "os": "windows",
          "arch": "x86_64",
          "backend": "rocm",
          "variant": "rocm-10.0",
          "files": [
            {
              "url": "https://github.com/ggml-org/llama.cpp/releases/download/b11669/llama-b11669-bin-win-rocm-10.0-x64.zip",
              "sizeBytes": 258449188,
              "sha256": "940aa2c42450500f73ddbbcf40c5101ce44062d8a9775e9cffc23804433f17ca"
            }
          ],
          "bundled": false
        },
        {
          "os": "macos",
          "arch": "aarch64",
          "backend": "metal",
          "variant": "metal",
          "files": [
            {
              "url": "https://github.com/ggml-org/llama.cpp/releases/download/b11669/llama-b11669-bin-macos-arm64.tar.gz",
              "sizeBytes": 12191582,
              "sha256": "dbed55493d72bc1ba2babc8770d669c2289b5bc4ee9fb2a4dfc158d45b7d13fd"
            }
          ],
          "bundled": true
        },
        {
          "os": "linux",
          "arch": "x86_64",
          "backend": "cpu",
          "variant": "cpu",
          "files": [
            {
              "url": "https://github.com/ggml-org/llama.cpp/releases/download/b11669/llama-b11669-bin-ubuntu-x64.tar.gz",
              "sizeBytes": 17851611,
              "sha256": "cf07c1c112d709bd67e522017471de57ed0ec8bea031d732c5422351c07f65ac"
            }
          ],
          "bundled": true
        },
        {
          "os": "linux",
          "arch": "x86_64",
          "backend": "vulkan",
          "variant": "vulkan",
          "files": [
            {
              "url": "https://github.com/ggml-org/llama.cpp/releases/download/b11669/llama-b11669-bin-ubuntu-vulkan-x64.tar.gz",
              "sizeBytes": 30497889,
              "sha256": "e8709e5ba6c1b093dea7f3de57f4aba842f9a188fba6b465782d65d6fcfa4d9f"
            }
          ],
          "bundled": true
        },
        {
          "os": "linux",
          "arch": "x86_64",
          "backend": "cuda",
          "variant": "cuda-13.4",
          "files": [
            {
              "url": "https://github.com/ggml-org/llama.cpp/releases/download/b11669/llama-b11669-bin-ubuntu-cuda-13.4-x64.tar.gz",
              "sizeBytes": 153679828,
              "sha256": "80878473d27278dbe9c38fb7e704f292a51e889d3c28a1e863137cdee1e2ba4e"
            },
            {
              "url": "https://github.com/ggml-org/llama.cpp/releases/download/b11669/cudart-llama-b11669-bin-ubuntu-cuda-13.4-x64.tar.gz",
              "sizeBytes": 440236547,
              "sha256": "1108bd9300a281e8eabb18d3fa028d4240ecd983f9f90dbbbc3297671016d697"
            }
          ],
          "bundled": false,
          "minCudaDriver": "13.0"
        }
      ]
    }
  ],
  "gpuHints": [
    {
      "nameContains": "RTX 5090",
      "bandwidthGbps": 1792
    },
    {
      "nameContains": "RTX 5080",
      "bandwidthGbps": 960
    },
    {
      "nameContains": "RTX 5070 Ti",
      "bandwidthGbps": 896
    },
    {
      "nameContains": "RTX 5070",
      "bandwidthGbps": 672
    },
    {
      "nameContains": "RTX 5060 Ti",
      "bandwidthGbps": 448
    },
    {
      "nameContains": "RTX 5060",
      "bandwidthGbps": 448
    },
    {
      "nameContains": "RTX 4090",
      "bandwidthGbps": 1008
    },
    {
      "nameContains": "RTX 4080 SUPER",
      "bandwidthGbps": 736
    },
    {
      "nameContains": "RTX 4080",
      "bandwidthGbps": 717
    },
    {
      "nameContains": "RTX 4070 Ti SUPER",
      "bandwidthGbps": 672
    },
    {
      "nameContains": "RTX 4070 Ti",
      "bandwidthGbps": 504
    },
    {
      "nameContains": "RTX 4070 SUPER",
      "bandwidthGbps": 504
    },
    {
      "nameContains": "RTX 4070",
      "bandwidthGbps": 504
    },
    {
      "nameContains": "RTX 4060 Ti",
      "bandwidthGbps": 288
    },
    {
      "nameContains": "RTX 4060",
      "bandwidthGbps": 272
    },
    {
      "nameContains": "RTX 3090 Ti",
      "bandwidthGbps": 1008
    },
    {
      "nameContains": "RTX 3090",
      "bandwidthGbps": 936
    },
    {
      "nameContains": "RTX 3080 Ti",
      "bandwidthGbps": 912
    },
    {
      "nameContains": "RTX 3080",
      "bandwidthGbps": 760
    },
    {
      "nameContains": "RTX 3070 Ti",
      "bandwidthGbps": 608
    },
    {
      "nameContains": "RTX 3070",
      "bandwidthGbps": 448
    },
    {
      "nameContains": "RTX 3060 Ti",
      "bandwidthGbps": 448
    },
    {
      "nameContains": "RTX 3060",
      "bandwidthGbps": 360
    },
    {
      "nameContains": "RX 9070 XT",
      "bandwidthGbps": 640
    },
    {
      "nameContains": "RX 9070",
      "bandwidthGbps": 640
    },
    {
      "nameContains": "RX 9060 XT",
      "bandwidthGbps": 320
    },
    {
      "nameContains": "RX 7900 XTX",
      "bandwidthGbps": 960
    },
    {
      "nameContains": "RX 7900 XT",
      "bandwidthGbps": 800
    },
    {
      "nameContains": "RX 7800 XT",
      "bandwidthGbps": 624
    },
    {
      "nameContains": "RX 7700 XT",
      "bandwidthGbps": 432
    },
    {
      "nameContains": "RX 7600",
      "bandwidthGbps": 288
    },
    {
      "nameContains": "Arc B580",
      "bandwidthGbps": 456
    },
    {
      "nameContains": "Arc A770",
      "bandwidthGbps": 560
    },
    {
      "nameContains": "Arc A750",
      "bandwidthGbps": 512
    },
    {
      "nameContains": "M1 Ultra",
      "bandwidthGbps": 800
    },
    {
      "nameContains": "M1 Max",
      "bandwidthGbps": 400
    },
    {
      "nameContains": "M1 Pro",
      "bandwidthGbps": 200
    },
    {
      "nameContains": "Apple M1",
      "bandwidthGbps": 68
    },
    {
      "nameContains": "M2 Ultra",
      "bandwidthGbps": 800
    },
    {
      "nameContains": "M2 Max",
      "bandwidthGbps": 400
    },
    {
      "nameContains": "M2 Pro",
      "bandwidthGbps": 200
    },
    {
      "nameContains": "Apple M2",
      "bandwidthGbps": 100
    },
    {
      "nameContains": "M3 Ultra",
      "bandwidthGbps": 819
    },
    {
      "nameContains": "M3 Max",
      "bandwidthGbps": 400
    },
    {
      "nameContains": "M3 Pro",
      "bandwidthGbps": 150
    },
    {
      "nameContains": "Apple M3",
      "bandwidthGbps": 100
    },
    {
      "nameContains": "M4 Max",
      "bandwidthGbps": 546
    },
    {
      "nameContains": "M4 Pro",
      "bandwidthGbps": 273
    },
    {
      "nameContains": "Apple M4",
      "bandwidthGbps": 120
    },
    {
      "nameContains": "Apple M5",
      "bandwidthGbps": 153
    }
  ],
  "models": [
    {
      "id": "qwen3.6-35b-a3b",
      "name": "Qwen3.6 35B-A3B",
      "family": "qwen3.6",
      "publisher": "Qwen (Alibaba), GGUF by Unsloth",
      "releaseDate": "2026-04-16",
      "roles": [
        "chat",
        "agent"
      ],
      "description": {